{"$schema":"https://json-schema.org/draft/2020-12/schema","$id":"https://example.invalid/gd-evaluation/schemas/adjudication-v0.1.schema.json","title":"Human Annotation Adjudication v0.1 hardened","type":"object","additionalProperties":false,"required":["contract_version","adjudication_id","episode_id","scenario_id","rater_sheet_ids","adjudicator_id","rubric_version","created_at","trigger_reasons","dimension_resolutions","overall_resolution_notes"],"$defs":{"resolutionEntry":{"type":"object","additionalProperties":false,"required":["dimension","rater_scores","agreement_class","final_score","final_evidence_message_ids","resolution_reason","not_evaluable_reason","rubric_issue_code"],"properties":{"dimension":{"enum":["issue_framing","logical_reasoning","listening_and_response","valuable_contribution","collaboration_and_relationship","decision_and_consensus","process_and_time_management"]},"rater_scores":{"type":"array","minItems":2,"maxItems":2,"items":{"oneOf":[{"type":"integer","minimum":1,"maximum":4},{"const":"NE"}]}},"agreement_class":{"enum":["exact","adjacent","major_disagreement","ne_disagreement"]},"final_score":{"oneOf":[{"type":"integer","minimum":1,"maximum":4},{"const":"NE"}]},"final_evidence_message_ids":{"type":"array","uniqueItems":true,"items":{"type":"string","minLength":1}},"resolution_reason":{"type":"string","minLength":1},"not_evaluable_reason":{"oneOf":[{"type":"null"},{"enum":["INSUFFICIENT_OPPORTUNITY","AI_QUALITY_FAILURE","TRANSCRIPT_INCOMPLETE","EVENT_ORDER_INVALID","SYSTEM_ERROR","SCENARIO_CONDITION_UNFAIR","SCENARIO_CONTRACT_FAILURE","INSUFFICIENT_EVIDENCE","JUDGE_FAILURE","OTHER_REVIEW_REQUIRED"]}]},"rubric_issue_code":{"oneOf":[{"type":"null"},{"enum":["ANCHOR_AMBIGUITY","OPPORTUNITY_DEFINITION_AMBIGUITY","EVIDENCE_SCOPE_AMBIGUITY","SCENARIO_DEFECT","PROCESS_DEVIATION","OTHER"]}]}},"allOf":[{"if":{"properties":{"final_score":{"const":"NE"}},"required":["final_score"]},"then":{"properties":{"not_evaluable_reason":{"enum":["INSUFFICIENT_OPPORTUNITY","AI_QUALITY_FAILURE","TRANSCRIPT_INCOMPLETE","EVENT_ORDER_INVALID","SYSTEM_ERROR","SCENARIO_CONDITION_UNFAIR","SCENARIO_CONTRACT_FAILURE","INSUFFICIENT_EVIDENCE","JUDGE_FAILURE","OTHER_REVIEW_REQUIRED"]},"final_evidence_message_ids":{"maxItems":0}}}},{"if":{"properties":{"final_score":{"type":"integer"}},"required":["final_score"]},"then":{"properties":{"not_evaluable_reason":{"type":"null"},"final_evidence_message_ids":{"minItems":1}}}},{"if":{"properties":{"final_score":{"const":4}},"required":["final_score"]},"then":{"properties":{"final_evidence_message_ids":{"minItems":2}}}}]}},"properties":{"contract_version":{"const":"0.1"},"adjudication_id":{"type":"string","minLength":1},"episode_id":{"type":"string","minLength":1},"scenario_id":{"type":"string","minLength":1},"rater_sheet_ids":{"type":"array","minItems":2,"maxItems":2,"uniqueItems":true,"items":{"type":"string","minLength":1}},"adjudicator_id":{"type":"string","minLength":1},"rubric_version":{"const":"candidate-behavior-v0.1"},"created_at":{"type":"string","format":"date-time"},"trigger_reasons":{"type":"array","minItems":1,"uniqueItems":true,"items":{"enum":["SCORE_GAP_TWO_OR_MORE","NUMERIC_NE_DISAGREEMENT","EVIDENCE_DISAGREEMENT","OPPORTUNITY_DISAGREEMENT","LOW_CONFIDENCE","RANDOM_CALIBRATION_SAMPLE","OTHER"]}},"dimension_resolutions":{"type":"array","minItems":7,"maxItems":7,"items":{"$ref":"#/$defs/resolutionEntry"},"allOf":[{"contains":{"properties":{"dimension":{"const":"issue_framing"}},"required":["dimension"]},"minContains":1,"maxContains":1},{"contains":{"properties":{"dimension":{"const":"logical_reasoning"}},"required":["dimension"]},"minContains":1,"maxContains":1},{"contains":{"properties":{"dimension":{"const":"listening_and_response"}},"required":["dimension"]},"minContains":1,"maxContains":1},{"contains":{"properties":{"dimension":{"const":"valuable_contribution"}},"required":["dimension"]},"minContains":1,"maxContains":1},{"contains":{"properties":{"dimension":{"const":"collaboration_and_relationship"}},"required":["dimension"]},"minContains":1,"maxContains":1},{"contains":{"properties":{"dimension":{"const":"decision_and_consensus"}},"required":["dimension"]},"minContains":1,"maxContains":1},{"contains":{"properties":{"dimension":{"const":"process_and_time_management"}},"required":["dimension"]},"minContains":1,"maxContains":1}]},"overall_resolution_notes":{"type":"string"}}}
