{"contract_version":"0.1","adjudication_id":"adj-exercise-a-low-001","episode_id":"exercise-a-low-001","scenario_id":"candidate-assessment-a-ambiguous-structure","rater_sheet_ids":["rater-a-exercise-a-low-001","rater-b-exercise-a-low-001"],"adjudicator_id":"adjudicator_low_anon","rubric_version":"candidate-behavior-v0.1","created_at":"2026-08-05T05:00:00Z","trigger_reasons":["RANDOM_CALIBRATION_SAMPLE"],"dimension_resolutions":[{"dimension":"issue_framing","rater_scores":[1,1],"agreement_class":"exact","final_score":1,"final_evidence_message_ids":["m004","m006"],"resolution_reason":"対象、制約、判断基準を整理せず、曖昧なまま案へ進んだ。","not_evaluable_reason":null,"rubric_issue_code":null},{"dimension":"logical_reasoning","rater_scores":[1,1],"agreement_class":"exact","final_score":1,"final_evidence_message_ids":["m014","m017","m020"],"resolution_reason":"選択理由や根拠を示さず、比較を行わなかった。","not_evaluable_reason":null,"rubric_issue_code":null},{"dimension":"listening_and_response","rater_scores":[2,2],"agreement_class":"exact","final_score":2,"final_evidence_message_ids":["m011","m016"],"resolution_reason":"懸念へ反応したが、内容を踏まえた修正や確認はなかった。","not_evaluable_reason":null,"rubric_issue_code":null},{"dimension":"valuable_contribution","rater_scores":[1,1],"agreement_class":"exact","final_score":1,"final_evidence_message_ids":["m009","m016","m017"],"resolution_reason":"既出の交流案を繰り返し、具体化や改善を行わなかった。","not_evaluable_reason":null,"rubric_issue_code":null},{"dimension":"collaboration_and_relationship","rater_scores":[2,2],"agreement_class":"exact","final_score":2,"final_evidence_message_ids":["m011","m016","m020"],"resolution_reason":"礼儀は保ったが、他者の参加促進や対立調整は行わなかった。","not_evaluable_reason":null,"rubric_issue_code":null},{"dimension":"decision_and_consensus","rater_scores":[1,1],"agreement_class":"exact","final_score":1,"final_evidence_message_ids":["m017","m020"],"resolution_reason":"判断基準なしに結論を急ぎ、反対意見や実行条件を扱わなかった。","not_evaluable_reason":null,"rubric_issue_code":null},{"dimension":"process_and_time_management","rater_scores":[1,1],"agreement_class":"exact","final_score":1,"final_evidence_message_ids":["m009","m021","m020"],"resolution_reason":"時間や進捗を管理せず、結論と次の行動を整理しなかった。","not_evaluable_reason":null,"rubric_issue_code":null}],"overall_resolution_notes":"low境界の観察行動とアンカー対応を確認した。"}
