{"contract_version":"0.1","adjudication_id":"adj-exercise-b-medium-001","episode_id":"exercise-b-medium-001","scenario_id":"candidate-assessment-b-stakeholder-conflict","rater_sheet_ids":["rater-a-exercise-b-medium-001","rater-b-exercise-b-medium-001"],"adjudicator_id":"adjudicator_anon","rubric_version":"candidate-behavior-v0.1","created_at":"2026-08-05T07:10:00Z","trigger_reasons":["RANDOM_CALIBRATION_SAMPLE"],"dimension_resolutions":[{"dimension":"issue_framing","rater_scores":[3,3],"agreement_class":"exact","final_score":3,"final_evidence_message_ids":["m005"],"resolution_reason":"予算上限、重点数、比較基準を明確にし、三つの利害を比較できる枠組みにした。","not_evaluable_reason":null,"rubric_issue_code":null},{"dimension":"logical_reasoning","rater_scores":[3,3],"agreement_class":"exact","final_score":3,"final_evidence_message_ids":["m017","m027"],"resolution_reason":"基準の優先順位と未採用施策への緩和策を理由付きで示した。","not_evaluable_reason":null,"rubric_issue_code":null},{"dimension":"listening_and_response","rater_scores":[3,3],"agreement_class":"exact","final_score":3,"final_evidence_message_ids":["m008","m011","m021"],"resolution_reason":"子育て、交通、観光の各懸念へ直接応答し、案を修正した。","not_evaluable_reason":null,"rubric_issue_code":null},{"dimension":"valuable_contribution","rater_scores":[3,3],"agreement_class":"exact","final_score":3,"final_evidence_message_ids":["m013","m019"],"resolution_reason":"三つの立場を重点配分と既存資源活用へ統合し、議論を前進させた。","not_evaluable_reason":null,"rubric_issue_code":null},{"dimension":"collaboration_and_relationship","rater_scores":[3,3],"agreement_class":"exact","final_score":3,"final_evidence_message_ids":["m008","m021","m029"],"resolution_reason":"対立を論点として扱い、少数意見を残したまま最終確認の場を作った。","not_evaluable_reason":null,"rubric_issue_code":null},{"dimension":"decision_and_consensus","rater_scores":[3,3],"agreement_class":"exact","final_score":3,"final_evidence_message_ids":["m023","m025","m027"],"resolution_reason":"基準に基づく配分と未採用施策の緩和策を含む結論を作った。","not_evaluable_reason":null,"rubric_issue_code":null},{"dimension":"process_and_time_management","rater_scores":[2,2],"agreement_class":"exact","final_score":2,"final_evidence_message_ids":["m033"],"resolution_reason":"終了前に残り時間と未解決点を整理したが、中盤の進捗調整は限定的だった。","not_evaluable_reason":null,"rubric_issue_code":null}],"overall_resolution_notes":"全7軸で独立評価が一致し、15評価機会の証拠連結を確認した。"}
