{"contract_version":"0.1","adjudication_id":"adj-exercise-b-high-001","episode_id":"exercise-b-high-001","scenario_id":"candidate-assessment-b-stakeholder-conflict","rater_sheet_ids":["rater-a-exercise-b-high-001","rater-b-exercise-b-high-001"],"adjudicator_id":"adjudicator_anon","rubric_version":"candidate-behavior-v0.1","created_at":"2026-08-05T08:50:00Z","trigger_reasons":["RANDOM_CALIBRATION_SAMPLE"],"dimension_resolutions":[{"dimension":"issue_framing","rater_scores":[4,4],"agreement_class":"exact","final_score":4,"final_evidence_message_ids":["m005","m019"],"resolution_reason":"初期条件を構造化し、後半の反論を受けて見直し条件まで判断枠組みに組み込んだ。","not_evaluable_reason":null,"rubric_issue_code":null},{"dimension":"logical_reasoning","rater_scores":[4,4],"agreement_class":"exact","final_score":4,"final_evidence_message_ids":["m017","m027"],"resolution_reason":"優先基準、各案の弱点、不確実性、再配分条件を複数局面で接続した。","not_evaluable_reason":null,"rubric_issue_code":null},{"dimension":"listening_and_response","rater_scores":[4,4],"agreement_class":"exact","final_score":4,"final_evidence_message_ids":["m008","m011","m021"],"resolution_reason":"三者の懸念を言い換え、案を修正し、残る反対条件まで確認した。","not_evaluable_reason":null,"rubric_issue_code":null},{"dimension":"valuable_contribution","rater_scores":[4,4],"agreement_class":"exact","final_score":4,"final_evidence_message_ids":["m013","m019"],"resolution_reason":"重点予算、既存資源、再配分を時間軸で統合する段階的ポートフォリオを作った。","not_evaluable_reason":null,"rubric_issue_code":null},{"dimension":"collaboration_and_relationship","rater_scores":[4,4],"agreement_class":"exact","final_score":4,"final_evidence_message_ids":["m008","m021","m029"],"resolution_reason":"少数意見を切り捨てず、三者が再度反対できる最終確認の場を作った。","not_evaluable_reason":null,"rubric_issue_code":null},{"dimension":"decision_and_consensus","rater_scores":[4,4],"agreement_class":"exact","final_score":4,"final_evidence_message_ids":["m023","m025","m027"],"resolution_reason":"基準、配分、リスク、緩和策、実施条件、再検討条件を含む合意を形成した。","not_evaluable_reason":null,"rubric_issue_code":null},{"dimension":"process_and_time_management","rater_scores":[3,3],"agreement_class":"exact","final_score":3,"final_evidence_message_ids":["m033"],"resolution_reason":"終盤で残時間を要約と確認へ配分し、未解決点の処理順を具体化した。","not_evaluable_reason":null,"rubric_issue_code":null}],"overall_resolution_notes":"全7軸で独立評価が一致し、Exercise B highの15評価機会との証拠連結を確認した。"}
