{"contract_version":"0.1","adjudication_id":"adj-exercise-a-medium-001","episode_id":"exercise-a-medium-001","scenario_id":"candidate-assessment-a-ambiguous-structure","rater_sheet_ids":["rater-a-exercise-a-medium-001","rater-b-exercise-a-medium-001"],"adjudicator_id":"adjudicator_anon","rubric_version":"candidate-behavior-v0.1","created_at":"2026-08-04T12:00:00Z","trigger_reasons":["EVIDENCE_DISAGREEMENT","RANDOM_CALIBRATION_SAMPLE"],"dimension_resolutions":[{"dimension":"issue_framing","rater_scores":[3,2],"agreement_class":"adjacent","final_score":3,"final_evidence_message_ids":["m004","m006","m007"],"resolution_reason":"証拠範囲を確認し、行動の前進効果よりもアンカーの必要条件を優先して確定した。","not_evaluable_reason":null,"rubric_issue_code":"ANCHOR_AMBIGUITY"},{"dimension":"logical_reasoning","rater_scores":[2,2],"agreement_class":"exact","final_score":2,"final_evidence_message_ids":["m014","m016"],"resolution_reason":"比較理由は示したが、数値や根拠の検証は限定的だった。","not_evaluable_reason":null,"rubric_issue_code":null},{"dimension":"listening_and_response","rater_scores":[3,3],"agreement_class":"exact","final_score":3,"final_evidence_message_ids":["m011","m016"],"resolution_reason":"騒音と動線の懸念へ直接応答し、案を修正した。","not_evaluable_reason":null,"rubric_issue_code":null},{"dimension":"valuable_contribution","rater_scores":[2,3],"agreement_class":"adjacent","final_score":2,"final_evidence_message_ids":["m009","m016"],"resolution_reason":"証拠範囲を確認し、行動の前進効果よりもアンカーの必要条件を優先して確定した。","not_evaluable_reason":null,"rubric_issue_code":"ANCHOR_AMBIGUITY"},{"dimension":"collaboration_and_relationship","rater_scores":[3,2],"agreement_class":"adjacent","final_score":3,"final_evidence_message_ids":["m011"],"resolution_reason":"証拠範囲を確認し、行動の前進効果よりもアンカーの必要条件を優先して確定した。","not_evaluable_reason":null,"rubric_issue_code":"ANCHOR_AMBIGUITY"},{"dimension":"decision_and_consensus","rater_scores":[3,3],"agreement_class":"exact","final_score":3,"final_evidence_message_ids":["m017","m020"],"resolution_reason":"基準と実証条件を含む結論を提示し、合意を確認した。","not_evaluable_reason":null,"rubric_issue_code":null},{"dimension":"process_and_time_management","rater_scores":[2,2],"agreement_class":"exact","final_score":2,"final_evidence_message_ids":["m021"],"resolution_reason":"最後に要約と見直し時点を示したが、途中の進捗調整は少ない。","not_evaluable_reason":null,"rubric_issue_code":null}],"overall_resolution_notes":"3軸に隣接差があり、証拠とアンカーを確認して確定した。"}
