{"adjudication_id":"adj-exercise-c-low-001","adjudicator_id":"adjudicator_anon","contract_version":"0.1","created_at":"2026-08-05T13:10:00Z","dimension_resolutions":[{"agreement_class":"exact","dimension":"issue_framing","final_evidence_message_ids":["m005"],"final_score":1,"not_evaluable_reason":null,"rater_scores":[1,1],"resolution_reason":"比較軸を具体化せず、無難さだけで方向を決めた。","rubric_issue_code":null},{"agreement_class":"exact","dimension":"logical_reasoning","final_evidence_message_ids":["m020","m028"],"final_score":1,"not_evaluable_reason":null,"rater_scores":[1,1],"resolution_reason":"三案の差や制約を検討せず、リスク後も根拠を更新しなかった。","rubric_issue_code":null},{"agreement_class":"exact","dimension":"listening_and_response","final_evidence_message_ids":["m008","m028"],"final_score":2,"not_evaluable_reason":null,"rater_scores":[2,2],"resolution_reason":"懸念には返答したが、内容を十分に受け止めた修正には至らなかった。","rubric_issue_code":null},{"agreement_class":"exact","dimension":"valuable_contribution","final_evidence_message_ids":["m010","m022"],"final_score":1,"not_evaluable_reason":null,"rater_scores":[1,1],"resolution_reason":"既存案を言い換えるだけで、制約を解く新しい提案を作らなかった。","rubric_issue_code":null},{"agreement_class":"exact","dimension":"collaboration_and_relationship","final_evidence_message_ids":["m012","m037"],"final_score":1,"not_evaluable_reason":null,"rater_scores":[1,1],"resolution_reason":"他参加者の立場を確認せず、合意を急いだ。","rubric_issue_code":null},{"agreement_class":"exact","dimension":"decision_and_consensus","final_evidence_message_ids":["m020","m028","m037"],"final_score":1,"not_evaluable_reason":null,"rater_scores":[1,1],"resolution_reason":"実施条件、例外、確認事項を詰めずに結論を固定した。","rubric_issue_code":null},{"agreement_class":"exact","dimension":"process_and_time_management","final_evidence_message_ids":["m018","m032","m039"],"final_score":1,"not_evaluable_reason":null,"rater_scores":[1,1],"resolution_reason":"時間通知後に優先順位を更新せず、終盤は検討を打ち切った。","rubric_issue_code":null}],"episode_id":"exercise-c-low-001","overall_resolution_notes":"Exercise C lowの証拠、機会、時間制約下の行動を確認した。","rater_sheet_ids":["rater-a-exercise-c-low-001","rater-b-exercise-c-low-001"],"rubric_version":"candidate-behavior-v0.1","scenario_id":"candidate-assessment-c-time-boxed-decision","trigger_reasons":["RANDOM_CALIBRATION_SAMPLE"]}
