{"adjudication_id":"adj-exercise-c-high-001","adjudicator_id":"adjudicator_anon","contract_version":"0.1","created_at":"2026-08-05T13:10:00Z","dimension_resolutions":[{"agreement_class":"exact","dimension":"issue_framing","final_evidence_message_ids":["m005"],"final_score":3,"not_evaluable_reason":null,"rater_scores":[3,3],"resolution_reason":"初期段階で優先条件と比較軸を明示し、未確定条件も管理対象にした。","rubric_issue_code":null},{"agreement_class":"exact","dimension":"logical_reasoning","final_evidence_message_ids":["m020","m028","m037"],"final_score":4,"not_evaluable_reason":null,"rater_scores":[4,4],"resolution_reason":"三案の弱点、遅延リスク、修正条件、実施条件を複数局面で接続した。","rubric_issue_code":null},{"agreement_class":"exact","dimension":"listening_and_response","final_evidence_message_ids":["m008","m028"],"final_score":4,"not_evaluable_reason":null,"rater_scores":[4,4],"resolution_reason":"セキュリティと地域採用者の懸念を言い換え、具体的な案変更へ反映した。","rubric_issue_code":null},{"agreement_class":"exact","dimension":"valuable_contribution","final_evidence_message_ids":["m010","m022"],"final_score":4,"not_evaluable_reason":null,"rater_scores":[4,4],"resolution_reason":"遠隔導入、指定会場端末、後日補講を組み合わせた新しい実施構造を作った。","rubric_issue_code":null},{"agreement_class":"exact","dimension":"collaboration_and_relationship","final_evidence_message_ids":["m012","m037"],"final_score":4,"not_evaluable_reason":null,"rater_scores":[4,4],"resolution_reason":"異なる立場を例外設計と確認条件へ統合し、合意可能な形へ整えた。","rubric_issue_code":null},{"agreement_class":"exact","dimension":"decision_and_consensus","final_evidence_message_ids":["m020","m028","m037"],"final_score":4,"not_evaluable_reason":null,"rater_scores":[4,4],"resolution_reason":"比較、修正、例外、責任者、再判断条件まで含む実行可能な合意を形成した。","rubric_issue_code":null},{"agreement_class":"exact","dimension":"process_and_time_management","final_evidence_message_ids":["m018","m032","m039"],"final_score":4,"not_evaluable_reason":null,"rater_scores":[4,4],"resolution_reason":"40%と75%の通知後に論点を絞り、結論と確認事項を時間内に分離した。","rubric_issue_code":null}],"episode_id":"exercise-c-high-001","overall_resolution_notes":"Exercise C highの証拠、機会、時間制約下の行動を確認した。","rater_sheet_ids":["rater-a-exercise-c-high-001","rater-b-exercise-c-high-001"],"rubric_version":"candidate-behavior-v0.1","scenario_id":"candidate-assessment-c-time-boxed-decision","trigger_reasons":["RANDOM_CALIBRATION_SAMPLE"]}
