{"contract_version":"0.1","adjudication_id":"adj-exercise-a-high-001","episode_id":"exercise-a-high-001","scenario_id":"candidate-assessment-a-ambiguous-structure","rater_sheet_ids":["rater-a-exercise-a-high-001","rater-b-exercise-a-high-001"],"adjudicator_id":"adjudicator_high_anon","rubric_version":"candidate-behavior-v0.1","created_at":"2026-08-05T04:00:00Z","trigger_reasons":["RANDOM_CALIBRATION_SAMPLE"],"dimension_resolutions":[{"dimension":"issue_framing","rater_scores":[4,4],"agreement_class":"exact","final_score":4,"final_evidence_message_ids":["m004","m014"],"resolution_reason":"目的、対象、制約、成功基準を構造化し、優先順位まで示した。","not_evaluable_reason":null,"rubric_issue_code":null},{"dimension":"logical_reasoning","rater_scores":[4,4],"agreement_class":"exact","final_score":4,"final_evidence_message_ids":["m014","m017","m020"],"resolution_reason":"二案の利点・リスク・撤退条件を比較し、不確実性を扱った。","not_evaluable_reason":null,"rubric_issue_code":null},{"dimension":"listening_and_response","rater_scores":[4,4],"agreement_class":"exact","final_score":4,"final_evidence_message_ids":["m011","m016"],"resolution_reason":"騒音と動線の懸念を言い換え、具体条件へ統合した。","not_evaluable_reason":null,"rubric_issue_code":null},{"dimension":"valuable_contribution","rater_scores":[4,4],"agreement_class":"exact","final_score":4,"final_evidence_message_ids":["m009","m016","m017"],"resolution_reason":"複数案を改善・統合し、運用表と撤退案まで補った。","not_evaluable_reason":null,"rubric_issue_code":null},{"dimension":"collaboration_and_relationship","rater_scores":[4,4],"agreement_class":"exact","final_score":4,"final_evidence_message_ids":["m011","m016","m020"],"resolution_reason":"三つの立場へ未解決点を問い、少数懸念を合意条件に組み込んだ。","not_evaluable_reason":null,"rubric_issue_code":null},{"dimension":"decision_and_consensus","rater_scores":[4,4],"agreement_class":"exact","final_score":4,"final_evidence_message_ids":["m014","m017","m020"],"resolution_reason":"指標、閾値、中間レビュー、撤退条件を含む合意を作った。","not_evaluable_reason":null,"rubric_issue_code":null},{"dimension":"process_and_time_management","rater_scores":[3,3],"agreement_class":"exact","final_score":3,"final_evidence_message_ids":["m009","m021"],"resolution_reason":"残り時間、次の論点、担当、中間レビューを具体化した。","not_evaluable_reason":null,"rubric_issue_code":null}],"overall_resolution_notes":"high境界の観察行動とアンカー対応を確認した。"}
