{"contract_version":"0.1","adjudication_id":"adjudication_example_001","episode_id":"session_example_001","scenario_id":"market-entry-001","rater_sheet_ids":["rater_sheet_example_a_001","rater_sheet_example_b_001"],"adjudicator_id":"adjudicator_anon_001","rubric_version":"candidate-behavior-v0.1","created_at":"2026-08-04T06:30:00Z","trigger_reasons":["EVIDENCE_DISAGREEMENT","RANDOM_CALIBRATION_SAMPLE"],"dimension_resolutions":[{"dimension":"issue_framing","rater_scores":[3,2],"agreement_class":"adjacent","final_score":3,"final_evidence_message_ids":["message_001"],"resolution_reason":"比較基準の提示は明確であり3を採用するが、対象・制約の不足を注記する。","not_evaluable_reason":null,"rubric_issue_code":"ANCHOR_AMBIGUITY"},{"dimension":"logical_reasoning","rater_scores":[2,2],"agreement_class":"exact","final_score":2,"final_evidence_message_ids":["message_001"],"resolution_reason":"両評価者が、理由・根拠の接続が限定的と判断した。","not_evaluable_reason":null,"rubric_issue_code":null},{"dimension":"listening_and_response","rater_scores":["NE","NE"],"agreement_class":"exact","final_score":"NE","final_evidence_message_ids":[],"resolution_reason":"評価機会不足について一致した。","not_evaluable_reason":"INSUFFICIENT_OPPORTUNITY","rubric_issue_code":null},{"dimension":"valuable_contribution","rater_scores":[2,3],"agreement_class":"adjacent","final_score":2,"final_evidence_message_ids":["message_001"],"resolution_reason":"前進効果はあるが、具体案の改善や新規分析までは観察されないため2とする。","not_evaluable_reason":null,"rubric_issue_code":"ANCHOR_AMBIGUITY"},{"dimension":"collaboration_and_relationship","rater_scores":["NE","NE"],"agreement_class":"exact","final_score":"NE","final_evidence_message_ids":[],"resolution_reason":"評価機会不足について一致した。","not_evaluable_reason":"INSUFFICIENT_OPPORTUNITY","rubric_issue_code":null},{"dimension":"decision_and_consensus","rater_scores":["NE","NE"],"agreement_class":"exact","final_score":"NE","final_evidence_message_ids":[],"resolution_reason":"評価機会不足について一致した。","not_evaluable_reason":"INSUFFICIENT_OPPORTUNITY","rubric_issue_code":null},{"dimension":"process_and_time_management","rater_scores":["NE","NE"],"agreement_class":"exact","final_score":"NE","final_evidence_message_ids":[],"resolution_reason":"評価機会不足について一致した。","not_evaluable_reason":"INSUFFICIENT_OPPORTUNITY","rubric_issue_code":null}],"overall_resolution_notes":"境界差はアンカー仕様へフィードバックする。"}
